{
  "$schema": "https://json-schema.org/draft/2020-12/schema",
  "$id": "https://github.com/praneetdhoolia/city-digital-twin/config/schema/overlay.schema.json",
  "title": "city-digital-twin overlay document",
  "description": "A partial override applied over the registry. Overlays carry VALUES ONLY - they may not introduce a field, nor change its units, source or sweep, because that would let a run invent an input outside the registry's provenance rules. The resolver rejects an overlay key that is not already a registry field, and rejects a value outside the field's sweep unless that key is listed in allow_outside_sweep with a justification.",
  "type": "object",
  "required": [
    "overlay",
    "set"
  ],
  "additionalProperties": false,
  "properties": {
    "overlay": {
      "type": "string",
      "minLength": 1,
      "description": "Identifier, e.g. 'S2', 'WEEKDAY', or a run tag."
    },
    "description": {
      "type": "string"
    },
    "applies_to": {
      "type": "object",
      "additionalProperties": false,
      "properties": {
        "scenario": {
          "type": "array",
          "items": {
            "type": "string"
          }
        },
        "day_type": {
          "type": "array",
          "items": {
            "type": "string",
            "description": "a day type the city declares in its city.json day_types - the vocabulary is the city's, never this schema's (the fixture city uses MON/SUN)"
          }
        }
      }
    },
    "set": {
      "type": "object",
      "propertyNames": {
        "pattern": "^[A-Z]+[.][a-z_0-9]+[.][A-Za-z_0-9.]+$"
      },
      "additionalProperties": true
    },
    "allow_outside_sweep": {
      "type": "array",
      "items": {
        "type": "string"
      },
      "description": "Field keys this overlay may set outside their declared sweep. Each entry must be justified in 'justification'. For deliberate stress tests, never for routine runs."
    },
    "justification": {
      "type": "object",
      "additionalProperties": {
        "type": "string"
      }
    },
    "answers_issues": {
      "type": "array",
      "items": {
        "type": "integer",
        "minimum": 1
      },
      "description": "The GitHub issue numbers this run's reading actually settles - the lane GOAL.md requirement 10 scopes by. When present this IS the lane, exactly and only; when absent the lane is scraped from the overlay's prose, which cannot read a negation and cannot tell a mention from a claim. Declare it for any arm whose launch is gated."
    }
  }
}
