{
  "overlay": "SAT",
  "description": "Saturday. 506,316 persons, 1,939,239 selected-plan legs, 879,400 tours. Beach and event demand is arguably this system's strongest use case, which is why weekend day types are built rather than noted.",
  "applies_to": {
    "day_type": [
      "SAT"
    ]
  },
  "set": {}
}
